{
  "schemaVersion": "execution.config@2.0.0",
  "paths": {
    "repositoryRoot": "/srv/crystra/repository",
    "workspaceRoot": "/srv/crystra/workspaces",
    "allowedWorktreeRoots": ["/srv/crystra/workspaces"],
    "stateRoot": "/var/lib/crystra/execution"
  },
  "workflowSource": {
    "kind": "github",
    "repository": "firestige/crystra-workflow-package",
    "releasesBaseUrl": "https://api.github.com/repos/firestige/crystra-workflow-package/releases",
    "assetPattern": "workflow-package-{name}-{version}.tar.gz"
  },
  "runner": {
    "implementationKey": "runner.v2",
    "host": { "engine": "langgraph" },
    "maxParallelToolCalls": 4
  },
  "observation": {
    "enabled": false,
    "timeoutMs": 1000,
    "maxBatchRecords": 512,
    "maxBatchBytes": 4194304,
    "flushIntervalMs": 1000,
    "shutdownFlushMs": 3000,
    "serviceName": "crystra-execution"
  },
  "controls": {
    "startupTimeoutMs": 30000,
    "executionTimeoutMs": 3600000,
    "shutdownTimeoutMs": 10000,
    "maxConcurrentDeliveries": 4,
    "allowExplicitRefresh": false,
    "diagnosticMaxBytes": 4096
  },
  "intake": { "maxCorrelationBytes": 256, "maxOutputBytes": 8192 }
}
